Unnamed: 0,original,scored_text,distance,score,ner_overlap
107,"«Больша́я росси́йская энциклопе́дия»[1] — российская универсальная энциклопедия на русском языке[2] Издание состоит из 35 нумерованных томов и тома «Россия», и содержит более 80 тысяч статей[3] Энциклопедия издавалась с 2004 по 2017 годы научным издательством «Большая российская энциклопедия»","«Больша́я росси́йская энциклопе́дия»[1] — российская универсальная энциклопедия на русском языке[2] Издание состоит из 35 нумерованных томов и тома «Россия», и содержит более 80 тысяч статей[3]",0.943780243396759,4,0.7272727272727273
108,"Вели́кое кня́жество Влади́мирское, до 1157года — Су́здальское княжество— русское княжество XII—XIVвеков, ставшее ядром современного Российского государстваВ узком смысле— территория, которой лично владел великий князь владимирский, в широком смысле— территория всех княжеств, выделившихся из Владимирского и зависимых от владимирского князя С середины XIII века сюзеренитет великих князей владимирских  признавали также Новгородская[2][3] и, с небольшими перерывами, Псковская республики[4]"," С середины XIII века сюзеренитет великих князей владимирских  признавали также Новгородская[2][3] и, с небольшими перерывами, Псковская республики[4]",0.9466265439987184,3,0.4666666666666667
109,"Новгоро́дская респу́блика — севернорусское средневековое государство, существовавшее с 1136 года по 1478 год В период наибольшего расцвета, кроме Новгородской земли в узком смысле, включала также территории от Балтийского моря на западе до Уральских гор на востоке и от Белого моря на севере до верховьев Волги и Западной Двины на юге Находясь с 1245 года под сюзеренитетом великих князей владимирских[1][2], титул которых с XIV века стали наследовать исключительно московские князья, Новгородская республика в 1478 году была завоёвана Иваном III и полностью вошла в состав централизованного Русского государства"," Находясь с 1245 года под сюзеренитетом великих князей владимирских[1][2], титул которых с XIV века стали наследовать исключительно московские князья, Новгородская республика в 1478 году была завоёвана Иваном III и полностью вошла в состав централизованного Русского государства",0.9311528205871582,3,0.45454545454545453
110,"Вели́кое кня́жество Лито́вское— восточноевропейское государство, существовавшее с середины XIII века по 1795 год на территории современных Белоруссии  Обширные земли Руси, попавшие под власть Великого княжества Литовского и составлявшие львиную долю его территории, именуются Литовской РусьюС 1385 года находилось в личной унии с Королевством Польским, а с 1569 года— в сеймовой Люблинской унии в составе федеративной Речи Посполитой","С 1385 года находилось в личной унии с Королевством Польским, а с 1569 года— в сеймовой Люблинской унии в составе федеративной Речи Посполитой",0.9183179140090942,3,0.3684210526315789
111,"Вели́кое кня́жество Моско́вское— средневековое русское княжество, существовавшее с 1263 по 1478 годы[1] Первоначально удел Великого княжества Владимирского, соперничавший с другими удельными княжествами за великокняжеский ярлык, выдаваемый ордынскими ханами Возвышению Москвы и укреплению её авторитета на Руси способствовал перенос кафедры киевского митрополита Петра из Владимира в Москву в 1325 году", Возвышению Москвы и укреплению её авторитета на Руси способствовал перенос кафедры киевского митрополита Петра из Владимира в Москву в 1325 году,0.9091284275054932,3,0.4375
112,"Оле́г — князь Новгородский с 879 года и великий князь Киевский с 882 годаПолучив власть над новгородскими землями после смерти Рюрика, как регент его малолетнего сына Игоря, Олег захватил Киев и перенёс туда столицу, объединив тем самым два главных центра восточных славян ", ,0.0,3,0.0
113,"Святосла́в Яросла́вич, в крещении Николай[1]  годом: «Родися третий сынъ Ярославу, и нарече имя ему Святославъ»[3] Второй раз в 1054 году, когда Ярослав поделил Русь между сыновьями"," Второй раз в 1054 году, когда Ярослав поделил Русь между сыновьями",0.9483648538589478,3,0.4166666666666667
114,"Святопо́лк В 1069 году отец посадил Святополка в Полоцке на место умершего Мстислава[2] В 1071 году Всеслав Брячиславич, прежний князь Полоцкий, вернул себе волость"," В 1071 году Всеслав Брячиславич, прежний князь Полоцкий, вернул себе волость",0.9367797374725342,3,0.3333333333333333
115,"Влади́мир Все́володович Монома́х , государственный деятель, военачальник, писатель, мыслитель На сохранившихся печатях Владимир Мономах использовал также титул архонт всея земли Русской, на манер византийского титула[3][4]Владимир Мономах был сыном князя Всеволода Ярославича",Владимир Мономах был сыном князя Всеволода Ярославича,0.9025723934173584,3,0.2857142857142857
116,"Яропо́лк Влади́мирович — сын Владимира Мономаха, князь переяславский, великий князь киевский с 1132 При нём распалось единое Древнерусское государствоЯрополк родился, вероятнее всего, в Чернигове, где тогда княжил его отец Владимир Мономах","Ярополк родился, вероятнее всего, в Чернигове, где тогда княжил его отец Владимир Мономах",0.924312710762024,3,0.2857142857142857
117,Все́волод О́льгович Всеволод был старшим сыном князя Олега Святославича[2] В 1111 году он вместе с другими князьями принимал участие в походе на половцев, В 1111 году он вместе с другими князьями принимал участие в походе на половцев,0.9600048065185548,3,0.4
118,"Ростисла́в Мстисла́вич  сын Мстислава, внук Владимира Мономаха Мать— Христина Шведская, дочь шведского короля Инге СтаршегоРостислав был лучшим блюстителем народных вечевых прав",Ростислав был лучшим блюстителем народных вечевых прав,0.9253881573677064,3,0.1111111111111111
119,"Глеб Ю́рьевич — князь Переяславский и Киевский, сын Юрия Долгорукого от брака с дочерью половецкого хана Аепы, брат Андрея БоголюбскогоВпервые упоминается в летописи в 1146/47 году В этом году 24 февраля в Колтеске умер его брат, курский князь Иван"," В этом году 24 февраля в Колтеске умер его брат, курский князь Иван",0.9366945028305054,3,0.3076923076923077
120,"Роман Ростиславич В 1151 году помогал Изяславу Мстиславичу отстаивать Киев от Юрия Долгорукого, много содействовал поражению последнего при реке Руте и защищал от него Чернигов В следующем году помогал Изяславу против Святослава Ольговича", В следующем году помогал Изяславу против Святослава Ольговича,0.8975269198417664,3,0.18181818181818182
121,"Рюрик Ростиславич[6][7][8]После смерти отца в 1167 году Рюрик остался княжить в Овруче, вытребовав владения у нового киевского князя и своего двоюродного брата Мстислава Изяславича Конфликтом за киевские волости воспользовался Андрей Боголюбский, и в 1169 году взял Киев для своего брата Глеба Юрьевича"," Конфликтом за киевские волости воспользовался Андрей Боголюбский, и в 1169 году взял Киев для своего брата Глеба Юрьевича",0.9299882650375366,3,0.46153846153846156
122,"Ростисла́в Рю́рикович , произошедшем во время пребывания «на Лучине» на пути из Новгорода в Смоленск, сообщается в Ипатьевской летописи, в сюжете под 1173 годом[3] В 1172 году «дасть ему отець его Лучин город в нем же родися»",дасть ему отець его Лучин город в нем же родися»,0.8805865645408629,3,0.08333333333333333
123,Яросла́в  родился 8 февраля 1191г в Переяславле Залесском 27 апреля 1194г, 27 апреля 1194г,0.8609453439712524,3,0.2
124,"Ростислав Мстиславич— Занял смоленский престол по смерти Мстислава Давыдовича в 1230 году В 1232 году был изгнан Святославом Мстиславичем, пришедшим с полоцкими войсками"," В 1232 году был изгнан Святославом Мстиславичем, пришедшим с полоцкими войсками",0.9439682960510254,3,0.4444444444444444
125,"Дании́л Рома́нович  и Ефросиньи-АнныПосле гибели отца в 1205 году стал галицким князем, но вскоре лишился престола С 1215 года княжил на Волыни и к 1231 году завершил объединение волынских земель", С 1215 года княжил на Волыни и к 1231 году завершил объединение волынских земель,0.9467509984970092,3,0.45454545454545453
126,"Алекса́ндр Яросла́вич Не́вский[комм 1]  Мстиславны, торопецкой княжны, дочери князя новгородского и галицкого Мстислава Удатного[2] По мнению историка Ю", По мнению историка Ю,0.8875150084495544,3,0.14285714285714285
127,"Ю́рий Третий сын Великого князя Владимирского Всеволода Юрьевича Большое Гнездо от первого брака, с Марией Шварновной Канонизирован Русской православной церковью в лике благоверных князей", Канонизирован Русской православной церковью в лике благоверных князей,0.9374085664749146,3,0.14285714285714285
128,"Константи́н Все́володович  До 1205 года он находился при отце, присутствуя, как представитель последнего, при освящении церквей во Владимире и участвуя в 1198 году в походе к Дону на половцев В конце 1190-х годов недолго княжил в Переяславле-Южном", В конце 1190-х годов недолго княжил в Переяславле-Южном,0.9320822954177856,3,0.2222222222222222
129,"Святосла́в Все́володович  февраля и в Соборе Владимирских святыхВ январе 1200 года он был назначен на княжение в Новгороде, а затем был сменён старшим братом, Константином в 1205 г и снова вернулся в Новгород 9 февраля 1208 года[2] Однако, уже следующей зимой Святослав был захвачен пригласившими на княжение Мстислава Удатного новгородцами и освобождён после похода владимирских войск во главе со старшими Всеволодовичами на Торжок"," Однако, уже следующей зимой Святослав был захвачен пригласившими на княжение Мстислава Удатного новгородцами и освобождён после похода владимирских войск во главе со старшими Всеволодовичами на Торжок",0.9175770878791808,3,0.2631578947368421
130,"Васи́лий Яросла́вич  Младший сын Ярослава Всеволодовича, великого князя киевского и владимирскогоРодился в городе Владимире",Родился в городе Владимире,0.8263891339302063,3,0.2
131,"Андре́й Алекса́ндрович, Андре́й Городе́цкий Из рода Рюриковичей, третий сын Александра Невского По завещанию отца получил в удел выделенное из состава Суздальского Городецкое княжество, которое оставалось в его владении до самой смерти"," По завещанию отца получил в удел выделенное из состава Суздальского Городецкое княжество, которое оставалось в его владении до самой смерти",0.9534764885902404,3,0.125
132,"Это статья о тверском и великом владимирском князе О московском князе, около года занимавшем владимирский престол, см Михаил Ярославич ХоробритМихаи́л Яросла́вич ", Михаил Ярославич ХоробритМихаи́л Яросла́вич ,0.9156068563461304,3,0.2
133,"Ю́рий — московский князь в 1303—1325, великий князь Владимирский в 1318—1322, князь Новгородский в 1322—1325Старший сын московского князя Даниила Александровича, внук Александра Невского Княжил в Переславле-Залесском, а с 1303года— в Москве"," Княжил в Переславле-Залесском, а с 1303года— в Москве",0.9181951284408568,3,0.29411764705882354
134,"Алекса́ндр Миха́йлович  Убит в Орде вместе с сыном ФёдоромВ 1318 году Великий князь Тверской Михаил Ярославич, отправляясь в Орду, разделил свою вотчину между Александром и его старшим братом, Дмитрием Грозные Очи","В 1318 году Великий князь Тверской Михаил Ярославич, отправляясь в Орду, разделил свою вотчину между Александром и его старшим братом, Дмитрием Грозные Очи",0.9262016415596008,3,0.6363636363636364
135,"Семён Ива́нович  И все князья Владимирской Руси, не желая наследника Калиты— Симеона Ивановича,— предлагали хану выдать ярлык на великое княжение Владимирское Константину Васильевичу Суздальскому, старшему из них по лествичному правуПока Симеон находился в Орде, в Москве вспыхнула первая крупная рознь между боярами, вызванная смертью московского тысяцкого Протасия Фёдоровича, который был тысяцким при Данииле Александровиче и Юрии и Иване Данииловичах","Пока Симеон находился в Орде, в Москве вспыхнула первая крупная рознь между боярами, вызванная смертью московского тысяцкого Протасия Фёдоровича, который был тысяцким при Данииле Александровиче и Юрии и Иване Данииловичах",0.9064804315567015,3,0.5333333333333333
136,"Дми́трий Ива́нович  Сын князя Ивана II Красного и его второй жены, княгини Александры ИвановныВ правление Дмитрия Московское княжество стало одним из главных центров объединения русских земель, а Владимирское великое княжество стало наследственной собственностью московских князей, хотя при этом из-под его влияния вышли Тверское и Смоленское княжества","В правление Дмитрия Московское княжество стало одним из главных центров объединения русских земель, а Владимирское великое княжество стало наследственной собственностью московских князей, хотя при этом из-под его влияния вышли Тверское и Смоленское княжества",0.9552350044250488,3,0.5454545454545454
137,"Васи́лий I Дми́триевич — великий князь московский и владимирский с 1389 года, старший сын Дмитрия Ивановича Донского и великой княгини Евдокии, дочери великого князя нижегородско-суздальского Дмитрия Константиновича Был женат на Софье— единственной дочери великого князя литовского ВитовтаРодился за день до празднования памяти святого Василия Кесарийского, и получил имя в его честь, в дальнейшем изображал его на своих печатях[1]","Родился за день до празднования памяти святого Василия Кесарийского, и получил имя в его честь, в дальнейшем изображал его на своих печатях[1]",0.9115159511566162,3,0.07692307692307693
138,"Ю́рий Дми́триевич  Юрий был очень популярен как удачливый полководец и опытный дипломат, а также покровитель искусств и литературы Был женат на Анастасии, дочери великого князя смоленского Юрия Святославича"," Был женат на Анастасии, дочери великого князя смоленского Юрия Святославича",0.9474843740463256,3,0.4
139,"СостояниеотпатрулированаДми́трий Ю́рьевич Шемя́ка — Великий князь Московский, а также князь Углицкий, князь Галицкий; сын Великого князя Московского Юрия Дмитриевича и княгини Анастасии Юрьевны, дочери последнего великого князя Смоленского Юрия Святославича, один из главных участников Междоусобной войны второй четверти XV века[2]:32[2]:95[3]:194, 195, 212 В летописях Дмитрий Юрьевич упоминается с 1433 года[4]:106 Точная дата рождения неизвестна[4]:106, в литературе встречаются указания на разные годы"," Точная дата рождения неизвестна[4]:106, в литературе встречаются указания на разные годы",0.9212961196899414,3,0.08333333333333333
140,"Ива́н Ива́нович Молодо́й — удельный князь Тверской, сын и наследник великого князя Московского Ивана III Васильевича и его первой жены Марии Борисовны, дочери великого князя тверского Бориса Александровича и сестры правящего в Твери Михаила Борисовича Как племянник Михаила Борисовича, у которого не было сыновей, претендовал на наследование Великого княжества ТверскогоРодился 15 февраля 1458 года",Родился 15 февраля 1458 года,0.7787773609161377,3,0.07142857142857142
141,"Васи́лий III Иванович, по прямому имени Гавриил, в постриге Варлаам — великий князь владимирский и московский в 1505—1533, государь всея Руси Сын Ивана III Великого и Софии Палеолог, отец Ивана IV Грозного В период его правления продолжился процесс собирания русских земель, в централизованное Русское государство вошли Псков, Смоленск и Рязань"," В период его правления продолжился процесс собирания русских земель, в централизованное Русское государство вошли Псков, Смоленск и Рязань",0.9328757524490356,3,0.4
