Unnamed: 0,original,scored_text,distance,score,ner_overlap
49,"Алекса́ндр Фёдорович Ке́ренский[1][2][3]  1917 года, свергнувшей Временное правительство, и безуспешной попытки вернуть власть сложил с себя все полномочия С июня 1918 года — в эмиграцииС отцовской стороны предки Александра Керенского происходят из среды провинциального духовенства","С отцовской стороны предки Александра Керенского происходят из среды провинциального духовенства С июня 1918 года — в эмиграцииАлекса́ндр Фёдорович Ке́ренский[1][2][3]  1917 года, свергнувшей Временное правительство, и безуспешной попытки вернуть власть сложил с себя все полномочия",0.8966214656829834,5,0.8888888888888888
50,"Лев Бори́сович Ка́менев ; с 1922 года— заместитель председателя СНК и СТО, а после смерти Ленина— председатель СТО до января 1926 года Член ЦК в 1917—1927 годах, член Политбюро ЦК в 1919—1926 годах, а затем кандидат в члены Политбюро Член ЦИК и председатель ВЦИК СССР"," Член ЦИК и председатель ВЦИК СССР Член ЦК в 1917—1927 годах, член Политбюро ЦК в 1919—1926 годах, а затем кандидат в члены ПолитбюроЛев Бори́сович Ка́менев ; с 1922 года— заместитель председателя СНК и СТО, а после смерти Ленина— председатель СТО до января 1926 года",0.9132092595100404,5,1.0
51,"Я́ков Миха́йлович[прим 1] Свердло́в[6]; партийные псевдонимы: Андрей[7], Андрей Уральский[8], товарищ Андрей[3], Макс[3], Махровый[9], Михаил Пермяков[3], Михалыч[10], Смирнов[3] и др[прим","[прим 1] Свердло́в[6]; партийные псевдонимы: Андрей[7], Андрей Уральский[8], товарищ Андрей[3], Макс[3], Махровый[9], Михаил Пермяков[3], Михалыч[10], Смирнов[3] и дрЯ́ков Миха́йлович[прим",0.9553270936012268,5,0.9411764705882353
52,"СостояниеотпатрулированаИо́сиф Виссарио́нович Ста́лин — российский революционер, советский политический, государственный, военный и партийный деятель С 21 января 1924 по 5 марта 1953— руководитель СССР[2][3] Маршал Советского Союза[4], Генералиссимус Советского Союза[5]"," Маршал Советского Союза[4], Генералиссимус Советского Союза[5] С 21 января 1924 по 5 марта 1953— руководитель СССР[2][3]СостояниеотпатрулированаИо́сиф Виссарио́нович Ста́лин — российский революционер, советский политический, государственный, военный и партийный деятель",0.9287479519844056,5,0.8461538461538461
53,"«Больша́я росси́йская энциклопе́дия»[1] — российская универсальная энциклопедия на русском языке[2] Издание состоит из 35 нумерованных томов и тома «Россия», и содержит более 80 тысяч статей[3] Энциклопедия издавалась с 2004 по 2017 годы научным издательством «Большая российская энциклопедия»"," Энциклопедия издавалась с 2004 по 2017 годы научным издательством «Большая российская энциклопедия» Издание состоит из 35 нумерованных томов и тома «Россия», и содержит более 80 тысяч статей[3]«Больша́я росси́йская энциклопе́дия»[1] — российская универсальная энциклопедия на русском языке[2]",0.9356387257575988,5,1.0
54,"Вели́кое кня́жество Влади́мирское, до 1157года — Су́здальское княжество— русское княжество XII—XIVвеков, ставшее ядром современного Российского государстваВ узком смысле— территория, которой лично владел великий князь владимирский, в широком смысле— территория всех княжеств, выделившихся из Владимирского и зависимых от владимирского князя С середины XIII века сюзеренитет великих князей владимирских  признавали также Новгородская[2][3] и, с небольшими перерывами, Псковская республики[4]","Вели́кое кня́жество Влади́мирское, до 1157года — Су́здальское княжество— русское княжество XII—XIVвеков, ставшее ядром современного Российского государстваВ узком смысле— территория, которой лично владел великий князь владимирский, в широком смысле— территория всех княжеств, выделившихся из Владимирского и зависимых от владимирского князя",0.9626457691192628,4,0.5333333333333333
55,"Новгоро́дская респу́блика — севернорусское средневековое государство, существовавшее с 1136 года по 1478 год В период наибольшего расцвета, кроме Новгородской земли в узком смысле, включала также территории от Балтийского моря на западе до Уральских гор на востоке и от Белого моря на севере до верховьев Волги и Западной Двины на юге Находясь с 1245 года под сюзеренитетом великих князей владимирских[1][2], титул которых с XIV века стали наследовать исключительно московские князья, Новгородская республика в 1478 году была завоёвана Иваном III и полностью вошла в состав централизованного Русского государства","Новгоро́дская респу́блика — севернорусское средневековое государство, существовавшее с 1136 года по 1478 год В период наибольшего расцвета, кроме Новгородской земли в узком смысле, включала также территории от Балтийского моря на западе до Уральских гор на востоке и от Белого моря на севере до верховьев Волги и Западной Двины на юге",0.948339343070984,4,0.5
56,"Вели́кое кня́жество Лито́вское— восточноевропейское государство, существовавшее с середины XIII века по 1795 год на территории современных Белоруссии  Обширные земли Руси, попавшие под власть Великого княжества Литовского и составлявшие львиную долю его территории, именуются Литовской РусьюС 1385 года находилось в личной унии с Королевством Польским, а с 1569 года— в сеймовой Люблинской унии в составе федеративной Речи Посполитой","Вели́кое кня́жество Лито́вское— восточноевропейское государство, существовавшее с середины XIII века по 1795 год на территории современных Белоруссии  Обширные земли Руси, попавшие под власть Великого княжества Литовского и составлявшие львиную долю его территории, именуются Литовской Русью",0.958939790725708,4,0.5789473684210527
57,"Вели́кое кня́жество Моско́вское— средневековое русское княжество, существовавшее с 1263 по 1478 годы[1] Первоначально удел Великого княжества Владимирского, соперничавший с другими удельными княжествами за великокняжеский ярлык, выдаваемый ордынскими ханами Возвышению Москвы и укреплению её авторитета на Руси способствовал перенос кафедры киевского митрополита Петра из Владимира в Москву в 1325 году","Вели́кое кня́жество Моско́вское— средневековое русское княжество, существовавшее с 1263 по 1478 годы[1] Первоначально удел Великого княжества Владимирского, соперничавший с другими удельными княжествами за великокняжеский ярлык, выдаваемый ордынскими ханами",0.954934537410736,4,0.5625
58,"Оле́г — князь Новгородский с 879 года и великий князь Киевский с 882 годаПолучив власть над новгородскими землями после смерти Рюрика, как регент его малолетнего сына Игоря, Олег захватил Киев и перенёс туда столицу, объединив тем самым два главных центра восточных славян ","Оле́г — князь Новгородский с 879 года и великий князь Киевский с 882 годаПолучив власть над новгородскими землями после смерти Рюрика, как регент его малолетнего сына Игоря, Олег захватил Киев и перенёс туда столицу, объединив тем самым два главных центра восточных славян",0.9999999403953552,4,1.0
59,"Святосла́в Яросла́вич, в крещении Николай[1]  годом: «Родися третий сынъ Ярославу, и нарече имя ему Святославъ»[3] Второй раз в 1054 году, когда Ярослав поделил Русь между сыновьями","Святосла́в Яросла́вич, в крещении Николай[1]  годом: «Родися третий сынъ Ярославу, и нарече имя ему Святославъ»[3]",0.9696817994117736,4,0.5833333333333334
60,"Святопо́лк В 1069 году отец посадил Святополка в Полоцке на место умершего Мстислава[2] В 1071 году Всеслав Брячиславич, прежний князь Полоцкий, вернул себе волость",Святопо́лк В 1069 году отец посадил Святополка в Полоцке на место умершего Мстислава[2],0.9515977501869202,4,0.6666666666666666
61,"Влади́мир Все́володович Монома́х , государственный деятель, военачальник, писатель, мыслитель На сохранившихся печатях Владимир Мономах использовал также титул архонт всея земли Русской, на манер византийского титула[3][4]Владимир Мономах был сыном князя Всеволода Ярославича","Влади́мир Все́володович Монома́х , государственный деятель, военачальник, писатель, мыслитель На сохранившихся печатях Владимир Мономах использовал также титул архонт всея земли Русской, на манер византийского титула[3][4]",0.9733271598815918,4,0.8571428571428571
62,"Яропо́лк Влади́мирович — сын Владимира Мономаха, князь переяславский, великий князь киевский с 1132 При нём распалось единое Древнерусское государствоЯрополк родился, вероятнее всего, в Чернигове, где тогда княжил его отец Владимир Мономах","Яропо́лк Влади́мирович — сын Владимира Мономаха, князь переяславский, великий князь киевский с 1132 При нём распалось единое Древнерусское государство",0.947076976299286,4,0.7142857142857143
63,Все́волод О́льгович Всеволод был старшим сыном князя Олега Святославича[2] В 1111 году он вместе с другими князьями принимал участие в походе на половцев,Все́волод О́льгович Всеволод был старшим сыном князя Олега Святославича[2],0.9610811471939088,4,0.6
64,"Ростисла́в Мстисла́вич  сын Мстислава, внук Владимира Мономаха Мать— Христина Шведская, дочь шведского короля Инге СтаршегоРостислав был лучшим блюстителем народных вечевых прав","Ростисла́в Мстисла́вич  сын Мстислава, внук Владимира Мономаха Мать— Христина Шведская, дочь шведского короля Инге Старшего",0.962067484855652,4,0.8888888888888888
65,"Глеб Ю́рьевич — князь Переяславский и Киевский, сын Юрия Долгорукого от брака с дочерью половецкого хана Аепы, брат Андрея БоголюбскогоВпервые упоминается в летописи в 1146/47 году В этом году 24 февраля в Колтеске умер его брат, курский князь Иван","Глеб Ю́рьевич — князь Переяславский и Киевский, сын Юрия Долгорукого от брака с дочерью половецкого хана Аепы, брат Андрея БоголюбскогоВпервые упоминается в летописи в 1146/47 году",0.9731881618499756,4,0.5384615384615384
66,"Роман Ростиславич В 1151 году помогал Изяславу Мстиславичу отстаивать Киев от Юрия Долгорукого, много содействовал поражению последнего при реке Руте и защищал от него Чернигов В следующем году помогал Изяславу против Святослава Ольговича","Роман Ростиславич В 1151 году помогал Изяславу Мстиславичу отстаивать Киев от Юрия Долгорукого, много содействовал поражению последнего при реке Руте и защищал от него Чернигов",0.9711325764656068,4,0.8181818181818182
67,"Рюрик Ростиславич[6][7][8]После смерти отца в 1167 году Рюрик остался княжить в Овруче, вытребовав владения у нового киевского князя и своего двоюродного брата Мстислава Изяславича Конфликтом за киевские волости воспользовался Андрей Боголюбский, и в 1169 году взял Киев для своего брата Глеба Юрьевича","Рюрик Ростиславич[6][7][8]После смерти отца в 1167 году Рюрик остался княжить в Овруче, вытребовав владения у нового киевского князя и своего двоюродного брата Мстислава Изяславича",0.9557345509529114,4,0.46153846153846156
68,"Ростисла́в Рю́рикович , произошедшем во время пребывания «на Лучине» на пути из Новгорода в Смоленск, сообщается в Ипатьевской летописи, в сюжете под 1173 годом[3] В 1172 году «дасть ему отець его Лучин город в нем же родися»","Ростисла́в Рю́рикович , произошедшем во время пребывания «на Лучине» на пути из Новгорода в Смоленск, сообщается в Ипатьевской летописи, в сюжете под 1173 годом[3] В 1172 году «",0.9747009873390198,4,0.8333333333333334
69,Яросла́в  родился 8 февраля 1191г в Переяславле Залесском 27 апреля 1194г,Яросла́в  родился 8 февраля 1191г в Переяславле Залесском,0.9574118852615356,4,0.8
70,"Ростислав Мстиславич— Занял смоленский престол по смерти Мстислава Давыдовича в 1230 году В 1232 году был изгнан Святославом Мстиславичем, пришедшим с полоцкими войсками",Ростислав Мстиславич— Занял смоленский престол по смерти Мстислава Давыдовича в 1230 году,0.9595838785171508,4,0.4444444444444444
71,"Дании́л Рома́нович  и Ефросиньи-АнныПосле гибели отца в 1205 году стал галицким князем, но вскоре лишился престола С 1215 года княжил на Волыни и к 1231 году завершил объединение волынских земель","Дании́л Рома́нович  и Ефросиньи-АнныПосле гибели отца в 1205 году стал галицким князем, но вскоре лишился престола",0.9661626815795898,4,0.5454545454545454
72,"Алекса́ндр Яросла́вич Не́вский[комм 1]  Мстиславны, торопецкой княжны, дочери князя новгородского и галицкого Мстислава Удатного[2] По мнению историка Ю","Алекса́ндр Яросла́вич Не́вский[комм 1]  Мстиславны, торопецкой княжны, дочери князя новгородского и галицкого Мстислава Удатного[2]",0.9735932350158693,4,0.8571428571428571
73,"Ю́рий Третий сын Великого князя Владимирского Всеволода Юрьевича Большое Гнездо от первого брака, с Марией Шварновной Канонизирован Русской православной церковью в лике благоверных князей","Ю́рий Третий сын Великого князя Владимирского Всеволода Юрьевича Большое Гнездо от первого брака, с Марией Шварновной",0.9653033614158629,4,0.7142857142857143
74,"Константи́н Все́володович  До 1205 года он находился при отце, присутствуя, как представитель последнего, при освящении церквей во Владимире и участвуя в 1198 году в походе к Дону на половцев В конце 1190-х годов недолго княжил в Переяславле-Южном","Константи́н Все́володович  До 1205 года он находился при отце, присутствуя, как представитель последнего, при освящении церквей во Владимире и участвуя в 1198 году в походе к Дону на половцев",0.9719292521476746,4,0.7777777777777778
75,"Святосла́в Все́володович  февраля и в Соборе Владимирских святыхВ январе 1200 года он был назначен на княжение в Новгороде, а затем был сменён старшим братом, Константином в 1205 г и снова вернулся в Новгород 9 февраля 1208 года[2] Однако, уже следующей зимой Святослав был захвачен пригласившими на княжение Мстислава Удатного новгородцами и освобождён после похода владимирских войск во главе со старшими Всеволодовичами на Торжок","Святосла́в Все́володович  февраля и в Соборе Владимирских святыхВ январе 1200 года он был назначен на княжение в Новгороде, а затем был сменён старшим братом, Константином в 1205 г и снова вернулся в Новгород 9 февраля 1208 года[2]",0.9573054313659668,4,0.5789473684210527
76,"Васи́лий Яросла́вич  Младший сын Ярослава Всеволодовича, великого князя киевского и владимирскогоРодился в городе Владимире","Васи́лий Яросла́вич  Младший сын Ярослава Всеволодовича, великого князя киевского и владимирского",0.9794617295265198,4,0.6
77,"Андре́й Алекса́ндрович, Андре́й Городе́цкий Из рода Рюриковичей, третий сын Александра Невского По завещанию отца получил в удел выделенное из состава Суздальского Городецкое княжество, которое оставалось в его владении до самой смерти","Андре́й Алекса́ндрович, Андре́й Городе́цкий Из рода Рюриковичей, третий сын Александра Невского",0.95513516664505,4,0.875
78,"Это статья о тверском и великом владимирском князе О московском князе, около года занимавшем владимирский престол, см Михаил Ярославич ХоробритМихаи́л Яросла́вич ","Это статья о тверском и великом владимирском князе О московском князе, около года занимавшем владимирский престол, см",0.9666951894760132,4,0.6
