Unnamed: 0,original,scored_text,distance,score,ner_overlap
26,"Алекса́ндр Миха́йлович  Убит в Орде вместе с сыном ФёдоромВ 1318 году Великий князь Тверской Михаил Ярославич, отправляясь в Орду, разделил свою вотчину между Александром и его старшим братом, Дмитрием Грозные Очи","В 1318 году Великий князь Тверской Михаил Ярославич, отправляясь в Орду, разделил свою вотчину между Александром и его старшим братом, Дмитрием Грозные Очи Убит в Орде вместе с сыном ФёдоромАлекса́ндр Миха́йлович ",0.8966171145439148,5,0.8181818181818182
27,"Семён Ива́нович  И все князья Владимирской Руси, не желая наследника Калиты— Симеона Ивановича,— предлагали хану выдать ярлык на великое княжение Владимирское Константину Васильевичу Суздальскому, старшему из них по лествичному правуПока Симеон находился в Орде, в Москве вспыхнула первая крупная рознь между боярами, вызванная смертью московского тысяцкого Протасия Фёдоровича, который был тысяцким при Данииле Александровиче и Юрии и Иване Данииловичах","Пока Симеон находился в Орде, в Москве вспыхнула первая крупная рознь между боярами, вызванная смертью московского тысяцкого Протасия Фёдоровича, который был тысяцким при Данииле Александровиче и Юрии и Иване Данииловичах И все князья Владимирской Руси, не желая наследника Калиты— Симеона Ивановича,— предлагали хану выдать ярлык на великое княжение Владимирское Константину Васильевичу Суздальскому, старшему из них по лествичному правуСемён Ива́нович ",0.8888435363769531,5,0.9333333333333333
28,"Дми́трий Ива́нович  Сын князя Ивана II Красного и его второй жены, княгини Александры ИвановныВ правление Дмитрия Московское княжество стало одним из главных центров объединения русских земель, а Владимирское великое княжество стало наследственной собственностью московских князей, хотя при этом из-под его влияния вышли Тверское и Смоленское княжества","В правление Дмитрия Московское княжество стало одним из главных центров объединения русских земель, а Владимирское великое княжество стало наследственной собственностью московских князей, хотя при этом из-под его влияния вышли Тверское и Смоленское княжества Сын князя Ивана II Красного и его второй жены, княгини Александры ИвановныДми́трий Ива́нович ",0.9086259007453918,5,0.8181818181818182
29,"Васи́лий I Дми́триевич — великий князь московский и владимирский с 1389 года, старший сын Дмитрия Ивановича Донского и великой княгини Евдокии, дочери великого князя нижегородско-суздальского Дмитрия Константиновича Был женат на Софье— единственной дочери великого князя литовского ВитовтаРодился за день до празднования памяти святого Василия Кесарийского, и получил имя в его честь, в дальнейшем изображал его на своих печатях[1]","Родился за день до празднования памяти святого Василия Кесарийского, и получил имя в его честь, в дальнейшем изображал его на своих печатях[1] Был женат на Софье— единственной дочери великого князя литовского ВитовтаВаси́лий I Дми́триевич — великий князь московский и владимирский с 1389 года, старший сын Дмитрия Ивановича Донского и великой княгини Евдокии, дочери великого князя нижегородско-суздальского Дмитрия Константиновича",0.8894358277320862,5,0.8461538461538461
30,"Ю́рий Дми́триевич  Юрий был очень популярен как удачливый полководец и опытный дипломат, а также покровитель искусств и литературы Был женат на Анастасии, дочери великого князя смоленского Юрия Святославича"," Был женат на Анастасии, дочери великого князя смоленского Юрия Святославича Юрий был очень популярен как удачливый полководец и опытный дипломат, а также покровитель искусств и литературыЮ́рий Дми́триевич ",0.910639464855194,5,0.8
31,"СостояниеотпатрулированаДми́трий Ю́рьевич Шемя́ка — Великий князь Московский, а также князь Углицкий, князь Галицкий; сын Великого князя Московского Юрия Дмитриевича и княгини Анастасии Юрьевны, дочери последнего великого князя Смоленского Юрия Святославича, один из главных участников Междоусобной войны второй четверти XV века[2]:32[2]:95[3]:194, 195, 212 В летописях Дмитрий Юрьевич упоминается с 1433 года[4]:106 Точная дата рождения неизвестна[4]:106, в литературе встречаются указания на разные годы"," Точная дата рождения неизвестна[4]:106, в литературе встречаются указания на разные годы В летописях Дмитрий Юрьевич упоминается с 1433 года[4]:106СостояниеотпатрулированаДми́трий Ю́рьевич Шемя́ка — Великий князь Московский, а также князь Углицкий, князь Галицкий; сын Великого князя Московского Юрия Дмитриевича и княгини Анастасии Юрьевны, дочери последнего великого князя Смоленского Юрия Святославича, один из главных участников Междоусобной войны второй четверти XV века[2]:32[2]:95[3]:194, 195, 212",0.904771089553833,5,0.9166666666666666
32,"Ива́н Ива́нович Молодо́й — удельный князь Тверской, сын и наследник великого князя Московского Ивана III Васильевича и его первой жены Марии Борисовны, дочери великого князя тверского Бориса Александровича и сестры правящего в Твери Михаила Борисовича Как племянник Михаила Борисовича, у которого не было сыновей, претендовал на наследование Великого княжества ТверскогоРодился 15 февраля 1458 года","Родился 15 февраля 1458 года Как племянник Михаила Борисовича, у которого не было сыновей, претендовал на наследование Великого княжества ТверскогоИва́н Ива́нович Молодо́й — удельный князь Тверской, сын и наследник великого князя Московского Ивана III Васильевича и его первой жены Марии Борисовны, дочери великого князя тверского Бориса Александровича и сестры правящего в Твери Михаила Борисовича",0.9046511054039,5,0.8571428571428571
33,"Васи́лий III Иванович, по прямому имени Гавриил, в постриге Варлаам — великий князь владимирский и московский в 1505—1533, государь всея Руси Сын Ивана III Великого и Софии Палеолог, отец Ивана IV Грозного В период его правления продолжился процесс собирания русских земель, в централизованное Русское государство вошли Псков, Смоленск и Рязань"," В период его правления продолжился процесс собирания русских земель, в централизованное Русское государство вошли Псков, Смоленск и Рязань Сын Ивана III Великого и Софии Палеолог, отец Ивана IV ГрозногоВаси́лий III Иванович, по прямому имени Гавриил, в постриге Варлаам — великий князь владимирский и московский в 1505—1533, государь всея Руси",0.8959710597991943,5,0.7333333333333333
34,"Фёдор I Ива́нович, известен также по имени Феодор Блаженный, Когда родился Фёдор, Иван Грозный повелел построить церковь в Феодоровском монастыре города Переславль-Залесский Этот храм в честь Феодора Стратилата стал главным собором монастыря и сохранился до настоящего времени"," Этот храм в честь Феодора Стратилата стал главным собором монастыря и сохранился до настоящего времениКогда родился Фёдор, Иван Грозный повелел построить церковь в Феодоровском монастыре города Переславль-ЗалесскийФёдор I Ива́нович, известен также по имени Феодор Блаженный, ",0.9000716805458069,5,0.5555555555555556
35,"Ирина Фёдоровна, урождённая   Годунова, в иночестве Александра — сестра Бориса Годунова и супруга царя Фёдора І Иоанновича, номинальная правительница на русском престоле после смерти Фёдора І Иоанновича и до избрания царём Бориса Годунова с 16 января по 21 февраля 1598 годаО дате и месте её рождения сведений нет Она была взята в царские палаты в возрасте семи лет и воспитывалась там до брака[1]"," Она была взята в царские палаты в возрасте семи лет и воспитывалась там до брака[1]О дате и месте её рождения сведений нетИрина Фёдоровна, урождённая   Годунова, в иночестве Александра — сестра Бориса Годунова и супруга царя Фёдора І Иоанновича, номинальная правительница на русском престоле после смерти Фёдора І Иоанновича и до избрания царём Бориса Годунова с 16 января по 21 февраля 1598 года",0.9021537303924559,5,0.9166666666666666
36,"Бори́с Фёдорович Годуно́в  По Государеву родословцу, составленному около 1555 года, у Дмитрия Зерно «было три сына: Иван, да Констянтин Шея, бездетен, да Дмитрей А у Ивана Дмитреевича дети: Фёдор Сабур, Данило Подольской, бездетен, да Иван Годун»[2]"," А у Ивана Дмитреевича дети: Фёдор Сабур, Данило Подольской, бездетен, да Иван Годун»[2] По Государеву родословцу, составленному около 1555 года, у Дмитрия Зерно «было три сына: Иван, да Констянтин Шея, бездетен, да ДмитрейБори́с Фёдорович Годуно́в ",0.8990115523338318,5,0.8235294117647058
37,Фёдор II Борисович  СФ,Ф СФёдор II Борисович ,0.7730668783187866,5,0.25
38,Васи́лий Иванович Шу́йский  После низложения жил в плену у поляковПоследний представитель рода Рюриковичей на российском престоле[3],Последний представитель рода Рюриковичей на российском престоле[3] После низложения жил в плену у поляковВаси́лий Иванович Шу́йский ,0.915444314479828,5,0.5
39,"Князь Дмитрий Тимофеевич Трубецкой , шенкурский державецВместе с Дмитрием Пожарским и Кузьмой Мининым руководил освобождением от поляков столицы, причём на время после изгнания поляков и до избрания Михаила Фёдоровича был избран правителем государства За свою деятельность получил титул «Спасителя отечества» и был одним из претендентов на царский престол на земском соборе 1613 года"," За свою деятельность получил титул «Спасителя отечества» и был одним из претендентов на царский престол на земском соборе 1613 годаВместе с Дмитрием Пожарским и Кузьмой Мининым руководил освобождением от поляков столицы, причём на время после изгнания поляков и до избрания Михаила Фёдоровича был избран правителем государстваКнязь Дмитрий Тимофеевич Трубецкой , шенкурский державец",0.9207772016525269,5,0.8571428571428571
40,"Михаи́л Фёдорович 1613годаРод Романовых принадлежит к числу древних семей московского боярства Первый известный по летописям представитель этого рода и нескольких других родов— Андрей Иванович, имевший прозвище Кобыла, в 1347 году находился на службе у Великого Владимирского и Московского князя Симеона Ивановича Гордого[2]"," Первый известный по летописям представитель этого рода и нескольких других родов— Андрей Иванович, имевший прозвище Кобыла, в 1347 году находился на службе у Великого Владимирского и Московского князя Симеона Ивановича Гордого[2]Род Романовых принадлежит к числу древних семей московского боярстваМихаи́л Фёдорович 1613года",0.8802515268325806,5,0.9090909090909091
41,"Патриа́рх Филаре́т  Разрядные книги свидетельствуют, что в феврале 1585 года будущий патриарх был участником приёма во дворце литовского посла Льва Сапеги[7][8][4], а в следующем году имел чин боярина и исполнял обязанности нижегородского наместника[8][4] В 1593—1594 годах Фёдор Никитич упоминается уже как псковский наместник[8]"," В 1593—1594 годах Фёдор Никитич упоминается уже как псковский наместник[8] Разрядные книги свидетельствуют, что в феврале 1585 года будущий патриарх был участником приёма во дворце литовского посла Льва Сапеги[7][8][4], а в следующем году имел чин боярина и исполнял обязанности нижегородского наместника[8][4]Патриа́рх Филаре́т ",0.936086654663086,5,0.9230769230769231
42,"Фёдор III Алексе́евич Фёдор Алексеевич, третий сын царя Алексея Михайловича и царицы Марии Милославской был крещён во имя святого Феодора Стратилата В марте 1669 года умерла его мать"," В марте 1669 года умерла его матьФёдор Алексеевич, третий сын царя Алексея Михайловича и царицы Марии Милославской был крещён во имя святого Феодора СтратилатаФёдор III Алексе́евич ",0.8805454969406128,5,0.5
43,Иоа́нн — русский царь в 1682—1696 годах из династии Романовых Сын царя Алексея Михайловича Тишайшего и царицы Марии Ильиничны Милославской Старший единокровный брат и соправитель Петра I, Старший единокровный брат и соправитель Петра I Сын царя Алексея Михайловича Тишайшего и царицы Марии Ильиничны МилославскойИоа́нн — русский царь в 1682—1696 годах из династии Романовых,0.9244513511657716,5,0.875
44,"А́нна Иоа́нновна 1710 года была выдана замуж за герцога Курляндского Фридриха Вильгельма Овдовевшая через 2,5 месяца после свадьбы, Анна была отправлена Петром I в Курляндию После смерти Петра II была приглашена в 1730 году на российский престол Верховным тайным советом как монарх с полномочиями, ограниченными в пользу аристократов— «верховников», но при поддержке дворян восстановила абсолютизм, распустив Верховный тайный совет"," После смерти Петра II была приглашена в 1730 году на российский престол Верховным тайным советом как монарх с полномочиями, ограниченными в пользу аристократов— «верховников», но при поддержке дворян восстановила абсолютизм, распустив Верховный тайный совет Овдовевшая через 2,5 месяца после свадьбы, Анна была отправлена Петром I в КурляндиюА́нна Иоа́нновна 1710 года была выдана замуж за герцога Курляндского Фридриха Вильгельма",0.8851432800292969,5,0.8666666666666667
45,Ива́н VI — российский император из Брауншвейгской ветви династии Романовых Царствовал с октября 1740 по ноябрь 1741 года Правнук Ивана V, Правнук Ивана V Царствовал с октября 1740 по ноябрь 1741 годаИва́н VI — российский император из Брауншвейгской ветви династии Романовых,0.90522438287735,5,0.5555555555555556
46,"СостояниеотпатрулированаЕлизаве́та Петро́вна , младшая дочь Петра I и Екатерины I, рождённая за два года до их вступления в брак Она руководила страной во время двух главных европейских конфликтов своего времени: Войны за австрийское наследство и Семилетней войны За время её правления обследованы и заселены земли Сибири"," За время её правления обследованы и заселены земли Сибири Она руководила страной во время двух главных европейских конфликтов своего времени: Войны за австрийское наследство и Семилетней войныСостояниеотпатрулированаЕлизаве́та Петро́вна , младшая дочь Петра I и Екатерины I, рождённая за два года до их вступления в брак",0.9146324396133424,5,0.7777777777777778
47,"СостояниеотпатрулированаПётр III Фёдорович — император всероссийский в 1762, первый представитель Гольштейн-Готторп-Романовской династии на российском престоле C 1745 года— владетельный герцог Гольштейн-Готторпский Внук Петра I— сын его дочери Анны и Карла Фридриха Гольштейн-Готторпского"," Внук Петра I— сын его дочери Анны и Карла Фридриха Гольштейн-Готторпского C 1745 года— владетельный герцог Гольштейн-ГотторпскийСостояниеотпатрулированаПётр III Фёдорович — император всероссийский в 1762, первый представитель Гольштейн-Готторп-Романовской династии на российском престоле",0.9308074116706848,5,0.9285714285714286
48,"Гео́ргий Евге́ньевич Львов  Старший брат Алексей с 1896 года возглавлял Московское училище живописи Другой брат, Владимир, руководил с 1901 года Московским главным архивом МИДа"," Другой брат, Владимир, руководил с 1901 года Московским главным архивом МИДа Старший брат Алексей с 1896 года возглавлял Московское училище живописиГео́ргий Евге́ньевич Львов ",0.9003123044967651,5,0.7272727272727273
