Unnamed: 0,original,scored_text,distance,score,ner_overlap
0,"Вели́кое кня́жество Влади́мирское, до 1157года — Су́здальское княжество— русское княжество XII—XIVвеков, ставшее ядром современного Российского государстваВ узком смысле— территория, которой лично владел великий князь владимирский, в широком смысле— территория всех княжеств, выделившихся из Владимирского и зависимых от владимирского князя С середины XIII века сюзеренитет великих князей владимирских  признавали также Новгородская[2][3] и, с небольшими перерывами, Псковская республики[4]"," С середины XIII века сюзеренитет великих князей владимирских  признавали также Новгородская[2][3] и, с небольшими перерывами, Псковская республики[4]В узком смысле— территория, которой лично владел великий князь владимирский, в широком смысле— территория всех княжеств, выделившихся из Владимирского и зависимых от владимирского князяВели́кое кня́жество Влади́мирское, до 1157года — Су́здальское княжество— русское княжество XII—XIVвеков, ставшее ядром современного Российского государства",0.923924207687378,5,0.9333333333333333
1,"Новгоро́дская респу́блика — севернорусское средневековое государство, существовавшее с 1136 года по 1478 год В период наибольшего расцвета, кроме Новгородской земли в узком смысле, включала также территории от Балтийского моря на западе до Уральских гор на востоке и от Белого моря на севере до верховьев Волги и Западной Двины на юге Находясь с 1245 года под сюзеренитетом великих князей владимирских[1][2], титул которых с XIV века стали наследовать исключительно московские князья, Новгородская республика в 1478 году была завоёвана Иваном III и полностью вошла в состав централизованного Русского государства"," Находясь с 1245 года под сюзеренитетом великих князей владимирских[1][2], титул которых с XIV века стали наследовать исключительно московские князья, Новгородская республика в 1478 году была завоёвана Иваном III и полностью вошла в состав централизованного Русского государства В период наибольшего расцвета, кроме Новгородской земли в узком смысле, включала также территории от Балтийского моря на западе до Уральских гор на востоке и от Белого моря на севере до верховьев Волги и Западной Двины на югеНовгоро́дская респу́блика — севернорусское средневековое государство, существовавшее с 1136 года по 1478 год",0.9081195592880248,5,0.8636363636363636
2,"Вели́кое кня́жество Лито́вское— восточноевропейское государство, существовавшее с середины XIII века по 1795 год на территории современных Белоруссии  Обширные земли Руси, попавшие под власть Великого княжества Литовского и составлявшие львиную долю его территории, именуются Литовской РусьюС 1385 года находилось в личной унии с Королевством Польским, а с 1569 года— в сеймовой Люблинской унии в составе федеративной Речи Посполитой","С 1385 года находилось в личной унии с Королевством Польским, а с 1569 года— в сеймовой Люблинской унии в составе федеративной Речи Посполитой Обширные земли Руси, попавшие под власть Великого княжества Литовского и составлявшие львиную долю его территории, именуются Литовской РусьюВели́кое кня́жество Лито́вское— восточноевропейское государство, существовавшее с середины XIII века по 1795 год на территории современных Белоруссии ",0.8618826270103455,5,0.7368421052631579
3,"Вели́кое кня́жество Моско́вское— средневековое русское княжество, существовавшее с 1263 по 1478 годы[1] Первоначально удел Великого княжества Владимирского, соперничавший с другими удельными княжествами за великокняжеский ярлык, выдаваемый ордынскими ханами Возвышению Москвы и укреплению её авторитета на Руси способствовал перенос кафедры киевского митрополита Петра из Владимира в Москву в 1325 году"," Возвышению Москвы и укреплению её авторитета на Руси способствовал перенос кафедры киевского митрополита Петра из Владимира в Москву в 1325 году Первоначально удел Великого княжества Владимирского, соперничавший с другими удельными княжествами за великокняжеский ярлык, выдаваемый ордынскими ханамиВели́кое кня́жество Моско́вское— средневековое русское княжество, существовавшее с 1263 по 1478 годы[1]",0.9014164209365844,5,0.9375
4,"Оле́г — князь Новгородский с 879 года и великий князь Киевский с 882 годаПолучив власть над новгородскими землями после смерти Рюрика, как регент его малолетнего сына Игоря, Олег захватил Киев и перенёс туда столицу, объединив тем самым два главных центра восточных славян "," Получив власть над новгородскими землями после смерти Рюрика, как регент его малолетнего сына Игоря, Олег захватил Киев и перенёс туда столицу, объединив тем самым два главных центра восточных славянОле́г — князь Новгородский с 879 года и великий князь Киевский с 882 года",0.9165088534355164,5,0.9
5,"Святосла́в Яросла́вич, в крещении Николай[1]  годом: «Родися третий сынъ Ярославу, и нарече имя ему Святославъ»[3] Второй раз в 1054 году, когда Ярослав поделил Русь между сыновьями"," Второй раз в 1054 году, когда Ярослав поделил Русь между сыновьями»[3]Святосла́в Яросла́вич, в крещении Николай[1]  годом: «Родися третий сынъ Ярославу, и нарече имя ему Святославъ",0.9031904339790344,5,0.9166666666666666
6,"Святопо́лк В 1069 году отец посадил Святополка в Полоцке на место умершего Мстислава[2] В 1071 году Всеслав Брячиславич, прежний князь Полоцкий, вернул себе волость"," В 1071 году Всеслав Брячиславич, прежний князь Полоцкий, вернул себе волостьВ 1069 году отец посадил Святополка в Полоцке на место умершего Мстислава[2]Святопо́лк ",0.9112085700035096,5,1.0
7,"Влади́мир Все́володович Монома́х , государственный деятель, военачальник, писатель, мыслитель На сохранившихся печатях Владимир Мономах использовал также титул архонт всея земли Русской, на манер византийского титула[3][4]Владимир Мономах был сыном князя Всеволода Ярославича","Владимир Мономах был сыном князя Всеволода Ярославича На сохранившихся печатях Владимир Мономах использовал также титул архонт всея земли Русской, на манер византийского титула[3][4]Влади́мир Все́володович Монома́х , государственный деятель, военачальник, писатель, мыслитель",0.9334312081336976,5,1.0
8,"Яропо́лк Влади́мирович — сын Владимира Мономаха, князь переяславский, великий князь киевский с 1132 При нём распалось единое Древнерусское государствоЯрополк родился, вероятнее всего, в Чернигове, где тогда княжил его отец Владимир Мономах","Ярополк родился, вероятнее всего, в Чернигове, где тогда княжил его отец Владимир Мономах При нём распалось единое Древнерусское государствоЯропо́лк Влади́мирович — сын Владимира Мономаха, князь переяславский, великий князь киевский с 1132",0.9335373044013976,5,0.5714285714285714
9,Все́волод О́льгович Всеволод был старшим сыном князя Олега Святославича[2] В 1111 году он вместе с другими князьями принимал участие в походе на половцев, В 1111 году он вместе с другими князьями принимал участие в походе на половцевВсеволод был старшим сыном князя Олега Святославича[2]Все́волод О́льгович ,0.908122181892395,5,0.8
10,"Ростисла́в Мстисла́вич  сын Мстислава, внук Владимира Мономаха Мать— Христина Шведская, дочь шведского короля Инге СтаршегоРостислав был лучшим блюстителем народных вечевых прав","Ростислав был лучшим блюстителем народных вечевых прав Мать— Христина Шведская, дочь шведского короля Инге СтаршегоРостисла́в Мстисла́вич  сын Мстислава, внук Владимира Мономаха",0.9122120141983032,5,0.8888888888888888
11,"Глеб Ю́рьевич — князь Переяславский и Киевский, сын Юрия Долгорукого от брака с дочерью половецкого хана Аепы, брат Андрея БоголюбскогоВпервые упоминается в летописи в 1146/47 году В этом году 24 февраля в Колтеске умер его брат, курский князь Иван"," В этом году 24 февраля в Колтеске умер его брат, курский князь ИванВпервые упоминается в летописи в 1146/47 годуГлеб Ю́рьевич — князь Переяславский и Киевский, сын Юрия Долгорукого от брака с дочерью половецкого хана Аепы, брат Андрея Боголюбского",0.8873586058616638,5,0.7692307692307693
12,"Роман Ростиславич В 1151 году помогал Изяславу Мстиславичу отстаивать Киев от Юрия Долгорукого, много содействовал поражению последнего при реке Руте и защищал от него Чернигов В следующем году помогал Изяславу против Святослава Ольговича"," В следующем году помогал Изяславу против Святослава ОльговичаВ 1151 году помогал Изяславу Мстиславичу отстаивать Киев от Юрия Долгорукого, много содействовал поражению последнего при реке Руте и защищал от него ЧерниговРоман Ростиславич ",0.9196146130561828,5,0.8181818181818182
13,"Рюрик Ростиславич[6][7][8]После смерти отца в 1167 году Рюрик остался княжить в Овруче, вытребовав владения у нового киевского князя и своего двоюродного брата Мстислава Изяславича Конфликтом за киевские волости воспользовался Андрей Боголюбский, и в 1169 году взял Киев для своего брата Глеба Юрьевича"," Конфликтом за киевские волости воспользовался Андрей Боголюбский, и в 1169 году взял Киев для своего брата Глеба ЮрьевичаПосле смерти отца в 1167 году Рюрик остался княжить в Овруче, вытребовав владения у нового киевского князя и своего двоюродного брата Мстислава ИзяславичаРюрик Ростиславич[6][7][8]",0.9018374681472778,5,0.7692307692307693
14,"Ростисла́в Рю́рикович , произошедшем во время пребывания «на Лучине» на пути из Новгорода в Смоленск, сообщается в Ипатьевской летописи, в сюжете под 1173 годом[3] В 1172 году «дасть ему отець его Лучин город в нем же родися»","дасть ему отець его Лучин город в нем же родися» В 1172 году «Ростисла́в Рю́рикович , произошедшем во время пребывания «на Лучине» на пути из Новгорода в Смоленск, сообщается в Ипатьевской летописи, в сюжете под 1173 годом[3]",0.919216513633728,5,1.0
15,Яросла́в  родился 8 февраля 1191г в Переяславле Залесском 27 апреля 1194г, 27 апреля 1194г в Переяславле ЗалесскомЯросла́в  родился 8 февраля 1191г,0.9082199931144714,5,0.8
16,"Ростислав Мстиславич— Занял смоленский престол по смерти Мстислава Давыдовича в 1230 году В 1232 году был изгнан Святославом Мстиславичем, пришедшим с полоцкими войсками"," В 1232 году был изгнан Святославом Мстиславичем, пришедшим с полоцкими войскамиЗанял смоленский престол по смерти Мстислава Давыдовича в 1230 годуРостислав Мстиславич— ",0.8921184539794922,5,0.5555555555555556
17,"Дании́л Рома́нович  и Ефросиньи-АнныПосле гибели отца в 1205 году стал галицким князем, но вскоре лишился престола С 1215 года княжил на Волыни и к 1231 году завершил объединение волынских земель"," С 1215 года княжил на Волыни и к 1231 году завершил объединение волынских земельПосле гибели отца в 1205 году стал галицким князем, но вскоре лишился престолаДании́л Рома́нович  и Ефросиньи-Анны",0.8938224315643309,5,0.8181818181818182
18,"Алекса́ндр Яросла́вич Не́вский[комм 1]  Мстиславны, торопецкой княжны, дочери князя новгородского и галицкого Мстислава Удатного[2] По мнению историка Ю"," По мнению историка Ю 1]  Мстиславны, торопецкой княжны, дочери князя новгородского и галицкого Мстислава Удатного[2]Алекса́ндр Яросла́вич Не́вский[комм",0.9249184131622314,5,0.8571428571428571
19,"Ю́рий Третий сын Великого князя Владимирского Всеволода Юрьевича Большое Гнездо от первого брака, с Марией Шварновной Канонизирован Русской православной церковью в лике благоверных князей"," Канонизирован Русской православной церковью в лике благоверных князейТретий сын Великого князя Владимирского Всеволода Юрьевича Большое Гнездо от первого брака, с Марией ШварновнойЮ́рий ",0.9039799571037292,5,0.5714285714285714
20,"Константи́н Все́володович  До 1205 года он находился при отце, присутствуя, как представитель последнего, при освящении церквей во Владимире и участвуя в 1198 году в походе к Дону на половцев В конце 1190-х годов недолго княжил в Переяславле-Южном"," В конце 1190-х годов недолго княжил в Переяславле-Южном До 1205 года он находился при отце, присутствуя, как представитель последнего, при освящении церквей во Владимире и участвуя в 1198 году в походе к Дону на половцевКонстанти́н Все́володович ",0.9087395668029784,5,0.8888888888888888
21,"Святосла́в Все́володович  февраля и в Соборе Владимирских святыхВ январе 1200 года он был назначен на княжение в Новгороде, а затем был сменён старшим братом, Константином в 1205 г и снова вернулся в Новгород 9 февраля 1208 года[2] Однако, уже следующей зимой Святослав был захвачен пригласившими на княжение Мстислава Удатного новгородцами и освобождён после похода владимирских войск во главе со старшими Всеволодовичами на Торжок"," Однако, уже следующей зимой Святослав был захвачен пригласившими на княжение Мстислава Удатного новгородцами и освобождён после похода владимирских войск во главе со старшими Всеволодовичами на Торжок и снова вернулся в Новгород 9 февраля 1208 года[2]Святосла́в Все́володович  февраля и в Соборе Владимирских святыхВ январе 1200 года он был назначен на княжение в Новгороде, а затем был сменён старшим братом, Константином в 1205 г",0.9014404416084291,5,0.7368421052631579
22,"Васи́лий Яросла́вич  Младший сын Ярослава Всеволодовича, великого князя киевского и владимирскогоРодился в городе Владимире","Родился в городе Владимире Младший сын Ярослава Всеволодовича, великого князя киевского и владимирскогоВаси́лий Яросла́вич ",0.8910274505615234,5,0.4
23,"Андре́й Алекса́ндрович, Андре́й Городе́цкий Из рода Рюриковичей, третий сын Александра Невского По завещанию отца получил в удел выделенное из состава Суздальского Городецкое княжество, которое оставалось в его владении до самой смерти"," По завещанию отца получил в удел выделенное из состава Суздальского Городецкое княжество, которое оставалось в его владении до самой смертиИз рода Рюриковичей, третий сын Александра НевскогоАндре́й Алекса́ндрович, Андре́й Городе́цкий ",0.8681891560554504,5,0.5
24,"Это статья о тверском и великом владимирском князе О московском князе, около года занимавшем владимирский престол, см Михаил Ярославич ХоробритМихаи́л Яросла́вич "," Михаил Ярославич ХоробритМихаи́л Яросла́вич  О московском князе, около года занимавшем владимирский престол, смЭто статья о тверском и великом владимирском князе",0.908312439918518,5,0.6
25,"Ю́рий — московский князь в 1303—1325, великий князь Владимирский в 1318—1322, князь Новгородский в 1322—1325Старший сын московского князя Даниила Александровича, внук Александра Невского Княжил в Переславле-Залесском, а с 1303года— в Москве"," Княжил в Переславле-Залесском, а с 1303года— в МосквеСтарший сын московского князя Даниила Александровича, внук Александра НевскогоЮ́рий — московский князь в 1303—1325, великий князь Владимирский в 1318—1322, князь Новгородский в 1322—1325",0.9076042175292968,5,0.7647058823529411
